sample_id,context,label_value,label_name,resp_0,resp_1,resp_2,resp_3,resp_4,metric_abs_hds_mean,metric_abs_hds_std,metric_AveragedCosineSimilarity,metric_AveragedDistinctNgrams,metric_BertScore,metric_SD,metric_SD_norm,metric_SSD,metric_SSD_norm,metric_SentBert,metric_TSD,metric_TSD_norm
test.sa-sb.sa-b::00656,Sarah lost her husband in the war. It had been years since she seen her husband. One day she gets a letter in the mail. It was a letter from her husband.,0.0,content_diversity,she was glad to get a letter,she was happy receiving the letter,the letter made her warm inside,she was ecstatic to get something from him,she feels overjoyed,2.278,0.671,-0.066,0.901,-0.420,2.206,0.441,4.587,0.917,-0.682,19.262,0.642
test.sa-sb.sa-b::00662,"My friends and I bought tickets to a music festival. Before the festival, we went to John's house to have lunch. We grilled chicken and drank beer. After lunch, we went to the music festival.",0.0,content_diversity,it was fantastic,the music festival was enjoyable,it was so pleasurable,I had a great time there,I enjoy myself at the music festival,2.111,0.698,-0.056,0.901,-0.365,2.441,0.488,4.645,0.929,-0.682,13.636,0.545
test.sa-sb.sa-b::00669,"Mark was a repairman. He started fixing things when he was very young. His dad taught him everything he knew. Then, he went to a trade school to learn more.",1.0,content_diversity,Mark obtained his certificates,Mark obtained his degrees,Mark became licensed,Mark started his own company,Mark knew that this was his calling,3.111,0.515,-0.099,0.893,-0.451,1.578,0.316,4.143,0.829,-0.622,13.437,0.584
test.sa-sb.sa::00572,"Sean and I went on a walk at about 3:00am. We liked to walk in the silence and stillness of night. Eventually, we sat next to the stream to watch it bubble past. When we had been there for a little while, he kissed me.",0.0,content_diversity,Sean raped me,I told him no after the kiss but he didn't stop.,Sean ended up violating me.,Sean forced me to have sex after he kissed me,Sean made me have sex with him,1.700,0.400,-0.063,0.927,-0.477,2.003,0.401,4.958,0.992,-0.572,22.069,0.552
test.sa-sb.sa::00579,"Pip built a treehouse with his dad. Tonight, they're going to have a super secret sleep over there. Pip made plans for the whole night and his dad bought snacks. Pip's mom promised she'd let them have a boys' night.",1.0,content_diversity,Sadly it rained and the roof leaked all night.,It was a wonderful night for Pip and his dad.,Pip and his dad had fun gazing at the stars.,Pip's dad told ghosts stories until they both fell asleep.,Pip's dad told him they could have more secret sleepovers in the future.,4.556,0.550,-0.055,0.909,-0.336,2.630,0.526,4.732,0.946,-0.399,35.881,0.588
test.sa-sb.sa::00588,"Tim loved the Price is Right. He got tickets to go once. He was actually picked as a contestant. He didn't win, but still had a lot of fun.",0.0,content_diversity,He enjoyed every second,He loved it.,He loved being there.,Every minute he loved.,The whole time was enjoyable.,1.833,0.577,-0.041,0.947,-0.426,2.657,0.531,4.746,0.949,-0.807,10.822,0.451
test.sa-sb.sa::00589,Steve got a sweater for his birthday. Steve didn't like the sweater at all. He brought the sweater to a donation center. Steve donated the sweater.,1.0,content_diversity,he was happy he donated it.,he thought it was a good thing to do.,he feels happy inside.,he was glad to do something nice,he was happy the sweater went to a good cause.,2.333,0.816,-0.099,0.871,-0.435,2.180,0.436,4.850,0.970,-0.665,22.637,0.566
test.sa-sb.sa::00600,My daughter came home from college. Se showed up at my door yesterday. I had no idea she was coming. I was so happy to see her face.,0.0,content_diversity,We gathered together as a family and had a dinner,Our whole family had a dinner together,We all enjoyed delicious meal together,We sat down and had a meal as a family,My wife made us a meal and we had dinner all together,1.571,0.416,-0.111,0.846,-0.527,2.215,0.443,4.899,0.980,-0.729,27.036,0.601
test.sa-sb.sa::00606,Larry went to eat at a diner. They had a juke box available. People chose three songs before him. Larry went to pick three more.,0.0,content_diversity,"Fearing the reactions of the diners,he didn't pick any songs.","Not wanting to embarrass himself,he didn't pick any songs.",He didn't like the selection so he didn't pick any songs.,"Not wanting to show off his bad taste in music,he didn't pick anything.",He was in a rush and decided not to waste time picking songs.,2.722,0.533,-0.113,0.862,-0.486,2.536,0.507,4.541,0.908,-0.552,44.139,0.573
test.sa-sb.sa::00611,Jane went downtown one night. She got drunk at the bar with friends. She got a ride home to be safe. The next day she tried to get her car back but it wasn't there.,1.0,content_diversity,She looked everywhere for the car.,She went to the police station and reported her car stolen.,She found out that she parked it in a parking garage.,She went to the impound lot to see if it was there.,The car was never found.,3.889,0.774,-0.051,0.909,-0.365,2.464,0.493,4.639,0.928,-0.367,31.518,0.630
test.sa-sb.sa::00613,"In 2013, my old boss started a nanobrewery. It was just a few pieces of equipment in an old storage building. In 2015 he got more equipment and better facilities. Last month he got approved for an equipment loan from the state of MA.",0.0,content_diversity,My boss is worried about how will he pay the loan to the bank,He might have to apply for refinancing,Owning large amount of money makes him depressed,Bank is sending him warnings about the loan repayment,He has to cut costs in order to repay the loan,2.889,0.809,-0.035,0.942,-0.260,2.386,0.477,4.980,0.996,-0.397,35.912,0.733
test.sa-sb.sa::00617,Laurie contacted me on Facebook. I found out she was my daughter. I had given her up for adoption when she was born. We talked for hours and hours.,1.0,content_diversity,She showed me pictures of her kids,Laurie is my only mixed race child.,She raises and breeds dogs for a living.,She had the nerve to ask about my will.,We decided to meet again the next day.,4.444,0.831,-0.015,0.974,-0.228,2.528,0.506,4.778,0.956,-0.164,25.822,0.601
test.sa-sb.sa::00621,John was invited to a barbecue. He was asked to bring extras. He got chips and dip. He was welcomed warmly at the barbecue.,0.0,content_diversity,They were able to finish eating before it rained.,The grills were moved into the garage.,Everyone moved into the basement to escape the rain.,The kids played outside in the rain and had fun.,The yard flooded from the rain.,3.500,0.667,-0.063,0.913,-0.375,2.861,0.572,4.998,1.000,-0.252,24.578,0.534
test.sa-sb.sa::00623,Larry wanted to go out with friends. They wanted to go to a bar. Larry had a bit of a drinking problem but went anyway. He got too drunk and made a fool of himself.,1.0,content_diversity,The bouncers had to throw him out of the bar,His friends had to watch him all night,He got so drunk that he spent the night hugging the toilet,He made a fool of himself in front of the girl he likes,"Seeing his condition, friends decided that it is enough and dragged him out of the bar",4.111,0.567,-0.067,0.890,-0.275,2.536,0.507,4.975,0.995,-0.255,45.178,0.753
test.sa-sb.sa::00630,Jane offered his friend some candy. He didn't tell him it was sour. Jane's friend popped it in her mouth right away. She immediately puckered her face.,1.0,content_diversity,Jane's friend accosted him for not warning him beforehand about the sourness of the candy.,Jane laughed as he watched his friend's face contort.,"As his friend's face puckered, Jane apologized profusely.",His friend tried to wrestle Jane to the ground as revenge for not warning her.,Jane's friend promptly started to gag.,4.056,0.685,-0.046,0.906,-0.324,2.801,0.560,4.844,0.969,-0.510,44.119,0.658
test.sa-sb.sa::00635,I had a nightmare the other night. It was so scary that it woke me up from my sleep. It took me a long time to go back to bed. I finally got back to sleep.,1.0,content_diversity,I had another nightmare.,My alarm went off and woke me up.,My cat jumped on me and woke me up.,My baby started screaming and startled me awake.,I woke to the smell of coffee.,4.000,0.745,-0.055,0.895,-0.441,2.340,0.468,4.968,0.994,-0.387,24.120,0.588
test.sa-sb.sa::00636,"Every Thanksgiving, Josie broke the wishbone with her father. It was their tradition since she was three years old. She waited patiently as her whole family sat down to their meal. She got up from her seat when her mother started clearing the table.",1.0,content_diversity,Her mother handed her the wishbone.,She grabbed the wishbone and walked over to her father.,She got the wishbone and broke it with her dad.,Her dad already had the wishbone and broke it with her.,Someone else had already broken the wishbone.,2.889,0.515,-0.161,0.765,-0.479,2.403,0.481,4.918,0.984,-0.577,26.865,0.548
test.sa-sb.sa::00645,A couple of Mormons challenged strangers to a basketball game. The others accepted. The Mormons were exceptionally good at the game. They beat the other guys fairly easily.,1.0,content_diversity,The other guys were good sports about it.,The Mormons started teasing the other guys.,The other guys were bad sports when they lost.,The others guys were shocked the Mormons were so good.,The other guys got mad and started beating the Mormons.,4.214,0.647,-0.138,0.839,-0.481,2.097,0.419,4.462,0.892,-0.500,29.726,0.607
test.sa-sb.sa::00663,I always wanted to take an art class. So when I turned 40 I enrolled into art classes. I was so nervous and didn't really talk to anyone unless necessary. Our first project was a group activity that forced everyone to talk.,1.0,content_diversity,I realized my classmates were really nice.,Everyone was so nice to talk to.,No one really wanted to talk to each other.,We met up at the bar every day after class.,By the end of the class we were friends.,3.111,0.657,-0.032,0.935,-0.278,2.850,0.570,4.966,0.993,-0.289,26.669,0.567
test.sa-sb.sa::00664,Jenny has decided that she wants to buy a cellphone. She goes to a store but finds many are expensive. Finally she finds a cell phone that fits her budget. Jenny buys it.,1.0,content_diversity,Jenny is happy with her purchase and loves her new phone,Jenny hates her cheap new phone and gets another one,As she's leaving the store she drops and breaks it,She loves her new phone and shows it to her friends,"Jenny spends all day programming her new phone, she loves it",3.833,0.624,-0.091,0.880,-0.387,2.861,0.572,4.606,0.921,-0.449,34.797,0.621
test.sa-sb.sa::00665,"Abby recently went diving in Jamaica. As Abby was diving, she grabbed a piece of coral. The instructor immediately scolded Abby for her error. Abby did not know she could not break off the coral.",1.0,content_diversity,Abby cried when she was told that she couldn't take the coral.,Abby tried to put the coral back.,The instructor felt bad for scolding and explained why she shouldn't take the coral.,Abby threw the coral back into the ocean.,Abby ran home and told her mother what happened.,4.611,0.393,-0.075,0.904,-0.324,2.603,0.521,4.952,0.990,-0.470,34.452,0.584
test.sa-sb.sa-b::00680,Tammy had a gambling addiction. Most forms are outlawed where she lives. Except for dog racing. She goes every weekend.,1.0,content_diversity,One weekend she went to the dog tracks and learned her lesson after spending her entire paycheck!,Last weekend she actually won $1000 and booked a trip to Mexico with the winnings.,Tammy fell in love with one of the Greyhounds and adopted him when he retired.,One day she booked a trip to Vegas where she could gamble even more.,Tammy's friends were worried about her so they staged an intervention.,4.722,0.533,-0.038,0.931,-0.225,3.272,0.654,4.987,0.997,-0.265,50.871,0.636
test.sa-sb.sa-b::00685,My sister-in-law B loved to nibble on raw hamburger. One day we were on vacation together. B made hamburgers for us. Later at night she had stomach cramps.,0.0,content_diversity,she made a bad choice,eating raw meat was a bad decision,she should not have eaten raw meat,she decides incorrectly,her decision was wrong,1.812,0.428,-0.040,0.919,-0.398,2.505,0.501,4.840,0.968,-0.494,13.327,0.513
test.sa-sb.sa-b::00687,Jake never cooked dinner. He thought he would surprise his girlfriend. He looked up online how to cook a fancy dinner. Jake only messed up small parts of it.,0.0,content_diversity,Jake was proud of learning something new.,Jake needed the extra help.,The additional knowledge let Jake succeed.,The extra research led to a happy event.,The meal went good by Jake's research.,3.389,0.906,-0.025,0.964,-0.331,2.943,0.589,4.978,0.996,-0.530,23.677,0.592
test.sa-sb.sa-b::00695,Joan went to the movies. She was going to meet her friend Lynn. Lynn was late for their meetings. Joan and Lynn bought their tickets.,1.0,content_diversity,they went inside the movie,they want the movies,they enjoy the movies,they went to dinner after,they went to the bar after,2.889,0.458,-0.123,0.844,-0.385,1.473,0.295,4.161,0.832,-0.351,13.194,0.550
test.sa-sb.sa-b::00697,The man baked the bread. The loaf looked perfect. He shared the load with his friends. His friends asked for the recipe.,0.0,content_diversity,He and his friends decided to have a competition to see who could bake the best loaf.,Together they agreed to compete to see who made the nicest bread.,A contest was put in place to determine who had the most excellent loaf ever.,They started a contest to see who's bread was superior.,The friends put a competition together so they could see who was the best bread baker.,1.812,0.658,-0.079,0.898,-0.549,3.279,0.656,4.735,0.947,-0.760,42.584,0.553
test.sa-sb.sa-b::00699,"Janet's family was used to tornado season where they lived. Luckily, they had avoided any major damage to their farm. They heard of a bad tornado coming their way. They weren't worried and didn't evacuate like their neighbors.",0.0,content_diversity,They all died as the tornado was so strong and destructive.,This time they were not so lucky and the house was destroyed by the tornado and they were all killed.,"This was a super tornado that destroyed the house, killing them all.",They all died this time becuase the tornado was so powerful.,The tornado was the biggest ever and tore their house apart and killed them all.,1.750,0.612,-0.110,0.862,-0.489,2.574,0.515,4.239,0.848,-0.795,48.200,0.643
test.sa-sb.sa-b::00700,Jake invited friends over to play board games. They had drinks and played Monopoly mostly. Everyone had a good time. Eventually there was no winner and it got late.,0.0,content_diversity,Everyone had so much fun.,All of the participants had a fabulous time.,Jake and his friends found their time playing games together to be enjoyable.,Each attendee had a wonderful time.,They all had a very pleasurable experience.,2.167,0.624,-0.045,0.952,-0.531,2.380,0.476,4.760,0.952,-0.737,27.266,0.620
test.sa-sb.sa-b::00701,Devin just got his licenses. He asks his parents for permission to out driving. While out driving he agrees to race one of his friends. Devin steps on the gas and races in his parents car.,1.0,content_diversity,he wrecks it,he won the race,he got pulled over,it was exhilerating,he felt bad after,4.389,0.515,-0.039,0.756,-0.218,1.856,0.371,4.961,0.992,-0.322,12.131,0.674
test.sa-sb.sa-b::00712,Tammy was at the park. She was watching her kids play. Tammy decided it was time to leave. She called her kids to the car.,0.0,content_diversity,they left,they leave the park,they went on with their car,they were on the road again,they drive away from the park,2.000,0.527,-0.071,0.923,-0.228,2.101,0.420,4.974,0.995,-0.398,14.909,0.621
test.sa-sb.sa-b::00725,I was at my cousin's house. And I wanted to walk to the mall. I thought I was familiar enough with the area. But I was lost for over an hour.,1.0,content_diversity,I got there eventually though.,I walked and walked and when I finally got there it was shut.,In the end I gave up and went back to my cousins house.,I am glad I didnt give up as when I got there they were giving away burgers!,A police car stopped and asked if I needed helo and they took me back to my cousins house.,4.056,0.497,-0.088,0.873,-0.219,2.842,0.568,4.942,0.988,-0.129,49.566,0.688
test.sa-sb.sa-b::00728,Tom was in the war. He got injured and received a purple heart. When he returned home it was meaningless. Nobody really cared other than to feel sorry for him.,0.0,content_diversity,He wondered if he should have done something else in his life.,He regretted choosing the military.,The purple heart was not worth the pity.,He felt his life was one big mistake.,He accepted that he chose incorrectly.,3.833,0.667,-0.031,0.953,-0.383,2.184,0.437,4.992,0.998,-0.339,26.085,0.593
test.sa-sb.sa-b::00730,Frank Ocean's album is to be released Friday. I don't believe it. He was supposed to release his album two years ago. He hasn't made music in that time period.,0.0,content_diversity,If I had to bet at least.,Just my opinion.,My person thoughts on it.,Only my personal vision on it.,I felt that way.,1.611,0.314,-0.020,0.958,-0.223,2.753,0.551,4.983,0.997,-0.357,18.141,0.605
test.sa-sb.sa-b::00735,"Today I took my motor scooter to the gas station to fill it with gas. Once it was filled, I tried to start it. It would not start. The man at the station gave me some oil to put in it.",1.0,content_diversity,My motor scooter still wouldn't start because the starter went out.,I ended having to take my scooter to a repair shop.,I always seem to have trouble with this scooter.,"I'm thinking about selling the scooter because I don't know how to work on it, myself.",I put the scooter in the garage because I'm tired of messing with it.,3.722,0.583,-0.049,0.941,-0.412,2.236,0.447,4.934,0.987,-0.471,48.210,0.643
test.sa-sb.sa-b::00739,Sam went out drinking. He tried to drive home. He couldn't find his keys. He had to call a taxi.,1.0,content_diversity,it was expensive,he left his car at the bar,no taxi was available so he ended up with an uber,he got home safely,he was hungry when he got home,4.000,0.667,-0.057,0.926,-0.230,2.274,0.455,4.996,0.999,-0.194,23.557,0.736
test.sa-sb.sa-b::00749,I went out to get a milkshake today. I went to my favorite ice cream shop to get one. When I got there I found out that milkshakes were very expensive. So I decided to get a cone instead.,1.0,content_diversity,The cone was delicious,THe cone was disappointing,"In contrast, the cone was very cheap","The cone was also expensive, but not as bad","It was ok, but not the same as a milkshake",3.833,0.577,-0.105,0.887,-0.245,2.594,0.519,4.827,0.965,-0.426,19.013,0.514
test.sa-sb.sa-b::00751,Tom was invited to a party. He wasn't much of a beer drinker. He got whatever he saw on sale. Everyone at the party was a bit disappointed.,0.0,content_diversity,Tom was so drunk he didnt care!,Tom had far too much to drink and couldn't rmemeber any criticism anyway.,Tom was so drunk and happy he didn't realise what people thought anyway.,Tom got drunk and was unaware people thought he was cheap.,After so much drink Tom didn't care anyway.,2.167,0.471,-0.085,0.879,-0.306,2.722,0.544,4.441,0.888,-0.686,38.482,0.611
test.sa-sb.sa-b::00759,Jake was at the bar one night. He decided to smoke but only had one cigarette left. He also had to go outside into the snow. Once outside his cigarette fell into the snow.,0.0,content_diversity,he stops,he chose to stop,he think it was time to stop smoking,he make the decision to stop the smoking,he decide it was a good idea to not smoke,1.667,0.471,-0.083,0.897,-0.380,1.999,0.400,4.704,0.941,-0.611,20.711,0.647
test.sa-sb.sa-b::00767,Kate and her friends drove all the way to Las Vegas. But they didn't like their hotel. So they decided to look online. They sat in the car looking on their phones for a better deal.,1.0,content_diversity,They found some good deals quickly.,The right one was found.,Cheaper and better housing was found.,They decided on a better deal.,The hotel was right next to the entertainment.,2.833,0.667,-0.038,0.941,-0.269,2.850,0.570,4.999,1.000,-0.334,16.350,0.454
test.sa-sb.sa-b::00768,"Abby was invited to a girl's trip to Seattle with her friends. Abby accepted the invitation, and were on their way to Seattle. After checking in the hotel, Abby fell straight asleep. When Abby awoke, her friends had returned from their night out.",0.0,content_diversity,she was hungry,abby felt hungry,abby stomach was growling,abby feel hunger in her stomach,abby can hear her stomach growling,1.500,0.408,-0.062,0.906,-0.423,2.738,0.548,4.633,0.927,-0.773,14.328,0.651
test.sa-sb.sa-b::00771,Jane and Carl had been struggling. Their relationship was in a bad spot. They got into a big fight over money issues. Both decided it was too much to handle.,1.0,content_diversity,they broke up,they decide on a break,they decide to find someone else,they think it was time for a new relationship,they look for someone new,2.278,0.786,-0.060,0.927,-0.322,1.698,0.340,4.998,1.000,-0.367,14.362,0.513
test.sa-sb.sa-b::00771,Jane and Carl had been struggling. Their relationship was in a bad spot. They got into a big fight over money issues. Both decided it was too much to handle.,0.0,content_diversity,they split up,they went their separate way,they end it,they end their relationship,their relationship was over,1.833,0.471,-0.073,0.898,-0.360,1.640,0.328,4.755,0.951,-0.672,12.977,0.683
test.sa-sb.sa::00355,Jane need to get something from the store. But she was late for an appointment. She grabbed her things quickly and headed to checkout. She thought it would be quick.,1.0,content_diversity,There was only one register open and there were six people in line.,The cash register ran out of receipt paper and the cashier had to call the manager to fix it.,There was one lady in line who saw she was in a hurry and let Jane go in front of her.,"The line was too long, so Jane hid the items in her coat and left the store without paying.",She got through the line just in time to make it to her appointment.,4.562,0.464,-0.053,0.925,-0.271,3.126,0.625,4.911,0.982,-0.402,63.496,0.690
test.sa-sb.sa::00358,Teddy had a passion. He had a passion to change his country for better. So he ran for president. Teddy told the american people what they wanted to hear.,0.0,content_diversity,"Despite the negative campaign ads, he was elected to be president.",People voted all over the country in great numbers to successfully get him elected.,He was surprised to win the presidency in a landslide victory.,His win was larger than any other president preceding him.,The other candidates were surprised at the astounding victory he had.,3.167,0.782,-0.037,0.944,-0.293,3.037,0.607,4.522,0.904,-0.586,39.934,0.634
test.sa-sb.sa::00371,The man put on his watch. His watch was not running. He took his watch off. He shook the watch.,0.0,content_diversity,The man was shocked when the watch came open and gears came out.,The man didn't even realize the watch had gears until they fell out of the now open watch.,The watch clearly needed repair after gears came tumbling out.,Surprisingly the watch sprang open and gears flew out.,The man tried to catch the gears as they fell out of the watch.,1.944,0.724,-0.128,0.835,-0.471,2.291,0.458,4.957,0.991,-0.693,42.561,0.599
test.sa-sb.sa::00372,"I bought a little stuffed giraffe. He was adorable, and I admired him in the checkout lane. I took him home to show my little girl. She fell in love with him on first sight.",1.0,content_diversity,She snuggled in bed with the little giraffe that night.,She takes him with her to daycare every day now.,She reads him stories before bed.,"Now, we have an extra chair at the table for the little giraffe.","Now, when she has to stay away from home, she feels comfortable having her little giraffe.",4.111,0.698,-0.040,0.929,-0.290,2.341,0.468,4.961,0.992,-0.293,38.922,0.617
test.sa-sb.sa::00375,Kate was cleaning the house. She had just mopped the floor. Her son came running through the room. He slipped on the wet floor.,0.0,content_diversity,The boy cried when he fell because he felt something snap.,The boy fell and when he used his arm to steady himself he broke it.,The boy broke his arm when he tried to grab the table next to him as he slipped.,Kate's son had a bone disease and slipping mildly caused his arm to break.,He fell while attempting a handstand after slipping.,3.222,0.478,-0.065,0.901,-0.377,2.654,0.531,4.946,0.989,-0.644,46.068,0.631
test.sa-sb.sa::00378,Ken is a cook. While at work Ken begins cooking meals. While cooking a customer notices Ken spitting in their food. They complain to the manger.,1.0,content_diversity,Ken is fired without an explanation.,The manager asks Ken about the situation.,The customer was an enemy of Ken and was trying to get him in trouble.,"Ken explains that it might have looked like he was spitting, but he wasn't.",The manager doesn't believe the customer because the customer cannot see the kitchen.,4.250,0.500,-0.032,0.937,-0.326,3.129,0.626,4.956,0.991,-0.344,37.474,0.577
test.sa-sb.sa::00380,Jerry was going on a blind date. He told his friend to call him with an emergency to get out of it. His friend called at the right time. Jerry played along.,1.0,content_diversity,He had second thoughts about it because the date was all of a sudden going better than he expected.,He felt guilty because he was being deceptive.,His date suspected he was trying to get out of the situation and walked out.,"He told his date that his friend had an emergency, paid and left.",Then Jerry confessed to his date that he way lying.,4.222,0.629,-0.048,0.925,-0.304,2.474,0.495,4.971,0.994,-0.310,49.263,0.694
