sample_id,context,label_value,label_name,resp_0,resp_1,resp_2,resp_3,resp_4,metric_abs_hds_mean,metric_abs_hds_std,metric_AveragedCosineSimilarity,metric_AveragedDistinctNgrams,metric_BertScore,metric_SD,metric_SD_norm,metric_SSD,metric_SSD_norm,metric_SentBert,metric_TSD,metric_TSD_norm
test.sa-sb.sa-b::00807,The man painted a truck. The paint peeled. A friend suggested primer. The man used primer the next time.,1.0,content_diversity,The paint still peeled off.,The paint stayed on this time.,The primer improved the next paint job.,The man decided to hire another painter to help him.,The friend offered his help on the next job.,4.056,0.437,-0.057,0.923,-0.346,2.021,0.404,4.684,0.937,-0.404,23.949,0.570
test.sa-sb.sa-b::00803,Kara went to the mall to find a bikini. She went to three different stores to try on suits. Kara found a bikini she liked at the fourth store. She found out the bikini was on sale when she got to the register.,0.0,content_diversity,she is happy with the saving,she is happy she can save money,the discount made her happy,saving money here gives her joy,she was ecstatic she could spend less,2.222,0.711,-0.057,0.904,-0.375,2.438,0.488,4.171,0.834,-0.777,21.639,0.698
test.sa-sb.sa-b::00793,Ann was a teacher at a local school. One day she gave her students a test. She caught a student cheating on the test. She sent the student to the office.,1.0,content_diversity,Student admitted his mistake,Student denied everything,Principal threatened to student with kicking him out,"In the office, student tried to threaten her",Student was sad,4.333,0.527,-0.023,0.969,-0.191,2.233,0.447,4.801,0.960,-0.379,16.621,0.616
test.sa-sb.sa-b::00813,One of the enemies was captured. He was tortured. He gave up some information. The information was put to good use.,1.0,content_diversity,he was then killed,he was then put into prison,the war ended,it was gruesome,that was part of war,3.667,0.471,-0.059,0.900,-0.273,2.049,0.410,4.258,0.852,-0.218,11.602,0.552
test.sa-sb.sa-b::00876,"I always look forward to the weekends. On Friday, we took off from work a little early. We bought some beer and champagne. We relaxed and had a few drinks together.",0.0,content_diversity,we also cook,we decided to use the kitchen,we prepare some meals,we use our cooking skills,we make some dishes,2.062,0.464,-0.056,0.945,-0.376,1.734,0.347,4.940,0.988,-0.672,12.232,0.556
test.sa-sb.sa-b::00825,It any business you have to keep track of your resources. I was helping a friend inventory his business. He could name every part number in his inventory from memory. I asked him to give me a list of his employees.,1.0,content_diversity,He had a hard time recollecting.,He new every name and their birthdays.,He could not name them without looking at his files.,He named them all off the top of his head.,He could not remember the names of his employees.,3.167,0.527,-0.053,0.920,-0.315,2.526,0.505,4.767,0.953,-0.246,28.704,0.611
test.sa-sb.sa-b::00830,Ben was a struggling actor. He went to several auditions. He finally got a call back on one of them. Ben got the part.,1.0,content_diversity,He called all his friends to tell them.,He was so happy he cried.,He realized he didn't really like acting very much so he quit.,His family was so proud they threw him a party.,His friend was jealous and they drifted apart.,4.562,0.464,-0.033,0.949,-0.280,2.175,0.435,4.998,1.000,-0.263,31.487,0.617
test.sa-sb.sa-b::00830,Ben was a struggling actor. He went to several auditions. He finally got a call back on one of them. Ben got the part.,0.0,content_diversity,He went home and told everyone he knew.,He was so excited that he called a ton of people to tell them.,He had to let everyone know asap.,Ben was super excited to share the news.,Ben had a great evening letting everyone know.,1.778,0.416,-0.040,0.937,-0.385,1.997,0.399,4.468,0.894,-0.571,32.019,0.640
test.sa-sb.sa-b::00792,My daughter and I started a new book last night. It was the first of a new series out. We enjoy reading together at night. We have read a lot of different books together.,1.0,content_diversity,We looked forward to the rest of the series.,This series would be discontinued.,The book was a fun way for us to connect.,I performed the characters using different voices to entertain her.,This would become her favorite book.,4.278,0.583,-0.025,0.955,-0.301,2.917,0.583,4.996,0.999,-0.233,26.520,0.589
test.sa-sb.sa-b::00799,I was walking with my foreign language exchange partner. We exchanged a few words. She made a small grammar mistake in her speech. I politely corrected her.,1.0,content_diversity,she said thank you,we continue practicing,she decided we should get ice cream,we had lots of fun,she teach me some foreign language too,4.111,0.657,-0.023,0.969,-0.172,1.850,0.370,4.985,0.997,-0.164,15.206,0.585
test.sa-sb.sa-b::00861,"My dad bought some nonalcoholic beer. Since it didn't have alcohol, I asked him if I could try it. He told me I wouldn't like it. I tried it, and made a terrible face.",0.0,content_diversity,I asked dad why he bought nonalcoholic beer.,"It tasted so bad, I asked my dad why he purchased it.",Why did dad buy this?,I wanted to know why dad bought nonalcoholic.,Why would he buy this kind of beer?,1.833,0.471,-0.061,0.903,-0.400,2.151,0.430,4.976,0.995,-0.557,28.172,0.599
test.sa-sb.sa-b::00871,"My wife and went to the movies in 1981. We saw the first movie. My wife did not like the second, Harold and Maude, and we left. Yesterday I saw the movie on DVR while my wife was at work.",1.0,content_diversity,I like it,I did not like it either,it was funny,it was not funny,it was not the same on tv,3.500,0.802,-0.123,0.845,-0.396,1.782,0.356,4.996,0.999,-0.371,14.072,0.612
test.sa-sb.sa::00681,Sean's car started overheating. He remembered a trick to cool it down. He turned on his heater to max. It helped keep the car going until he got to a mechanic.,0.0,content_diversity,Sean decided to replace his old car with a new one,He purchased another car,"After that incident, he decided it's time to get a new car","To avoid problems in future, he decided to buy a new car",He replaced his old vehicle with a new one,2.062,0.916,-0.094,0.857,-0.505,2.961,0.592,4.923,0.985,-0.592,32.752,0.630
test.sa-sb.sa::00682,Kate had slept most of the way on the road trip. She was awake now. But she had no headphones to listen to music. Her eyes felt heavy as she stared at the road passing by.,0.0,content_diversity,Car has hit a tree and she bumped into the seat in front of her,Driver lost control of the vehicle and bumped in the tree,She felt braking and could see car crashed in the tree,"Suddenly, she felt strong force and she was on the floor",She felt someone pulling the handbrake as they were crashing in the tree,2.000,0.408,-0.089,0.899,-0.326,2.361,0.472,4.560,0.912,-0.521,47.865,0.772
test.sa-sb.sa::00689,Our relationship confuses me. We got into another argument. He accused me of not working hard. I explained my computer was being slow.,1.0,content_diversity,He told me to stop changing the subject.,I bought a new computer instead of fixing the slow one.,I walked out of the room before I said something I regretted.,He smashed the computer when I complained about it.,I decided to ignore him and tried to work as best as I could on the slow computer.,4.188,0.658,-0.052,0.934,-0.292,2.154,0.431,4.992,0.998,-0.311,44.134,0.701
test.sa-sb.sa::00691,Jane noticed her internet was slow. The cable company was no help. Eventually someone recommended getting a better router. Jane tried it out.,1.0,content_diversity,she was happy with her new interernet,she like its,she did not like it,she was glad she did,she is happy she got a new router,3.222,0.711,-0.087,0.904,-0.264,1.865,0.373,4.771,0.954,-0.468,19.132,0.683
test.sa-sb.sa::00698,Joel owned a restaurant. He hired a cook that didn't care about his work. The cook didn't clean after himself. The kitchen was a mess.,1.0,content_diversity,Joel fired the cook when things went too far downhill.,One day Joel called a meeting and set up new rules for the cook and other staff to follow.,This went on for a couple months before Joel had enough.,Joel did not care much about the restaurant either and he went out of business.,When making future hiring decisions Joel held up the cook as an example of what he doesn't want.,4.556,0.497,-0.044,0.945,-0.243,3.013,0.603,4.966,0.993,-0.370,48.366,0.605
test.sa-sb.sa::00698,Joel owned a restaurant. He hired a cook that didn't care about his work. The cook didn't clean after himself. The kitchen was a mess.,0.0,content_diversity,One day the cook showed up at the restaurant and was very angry.,The cook pleaded for another chance.,It was time to start over and pick up the pieces.,Joel discovered that the cook had been battling a severe illness and it had affected his work.,From that day forward Joel's restaurant was the best in town.,4.278,0.533,-0.035,0.945,-0.266,2.825,0.565,4.992,0.998,-0.270,38.144,0.587
test.sa-sb.sa::00699,"Janet's family was used to tornado season where they lived. Luckily, they had avoided any major damage to their farm. They heard of a bad tornado coming their way. They weren't worried and didn't evacuate like their neighbors.",1.0,content_diversity,They were lucky that the tornado did not make it to their farm.,This was a bad decision because Janet's mother did not make it.,Everything worked out because the tornado died out before it could reach the farm.,They were able to protect the animals but their garden was destroyed by the tornado.,The family is not afraid of tornadoes anymore.,4.111,0.458,-0.054,0.902,-0.322,2.912,0.582,4.193,0.839,-0.402,41.752,0.605
test.sa-sb.sa::00701,Devin just got his licenses. He asks his parents for permission to out driving. While out driving he agrees to race one of his friends. Devin steps on the gas and races in his parents car.,1.0,content_diversity,Devin goes 100 mph and gets pulled over by the police.,Devin hits a telephone pole and totals his parents car.,Devin forgets his license and gets arrested.,Devin's little brother was with him and snitched to their parents.,Devin gets lost and has to call his parents.,4.667,0.333,-0.061,0.932,-0.393,2.184,0.437,4.993,0.999,-0.447,31.240,0.568
test.sa-sb.sa::00703,Jake was changing clothes in his room. He didn't realize his overhead fan was on. When he reached up to take off his shirt his arm hit the fan blades. Jake wound up fracturing his wrist.,1.0,content_diversity,"His mom ran upstairs when she heard the commotion, and immediately drove him to the emergency room.","He had to wear a cast and was unable to play his favorite sport, baseball, for an entire month.",He thought it was cool so he showed it to the neighborhood kids.,He was in agonizing pain so he raced to the phone to call an ambulance.,He then woke up and realized it was all a dream.,4.167,0.707,-0.055,0.930,-0.274,2.670,0.534,4.999,1.000,-0.200,52.243,0.629
test.sa-sb.sa::00705,Jim has a very important math test next week. He is really worried about passing with a good grade. Jim decided to ask his teacher for ideas on great study tips. His teacher gave him some really great studying advice.,0.0,content_diversity,Confidence flowed through Jim as he realized he easily solved all the questions.,The teacher handed back Jim's test which got full marks.,Jim got a hundred on the test.,Jim ended up doing well and passing the math test.,He came home happy he passed the test.,2.667,0.577,-0.042,0.950,-0.374,2.768,0.554,4.878,0.976,-0.540,33.604,0.611
test.sa-sb.sa::00706,"My textbook went missing. I tried to look inside the laundry room. Dust was flying everywhere, especially on the desk. I managed to find the book inside a bin.",1.0,content_diversity,Someone had hidden it there after damaging it.,I was very happy to have my textbook and sat down to study.,I felt mystified as to why the book was in a bin but was relieved I had found it.,I opened the book and got down to catching up on my studies.,Later in the day my roommate admitted they had been tidying and put my book there.,3.857,0.693,-0.045,0.924,-0.282,2.652,0.530,4.976,0.995,-0.423,46.946,0.634
test.sa-sb.sa::00709,I put my dog in training school. He is learning a lot of new tricks. He can now sit and stand. They are very good teachers.,0.0,content_diversity,We joined together with our new friends to put together a dog trick stage show.,My pup has never been happier.,Now people gasp with delight when they see what my dog can do.,Our new friends agreed that these were the best dog trainers ever.,We all decided to stay in touch and do doggy play dates.,4.389,0.698,-0.015,0.965,-0.248,2.728,0.546,4.950,0.990,-0.520,36.577,0.581
test.sa-sb.sa::00714,Sam was at work. He had to lift a heavy box by himself. Sam pulled a muscle trying to do so. He had to get physical therapy to get better.,1.0,content_diversity,"After physical therapy, he was more fit than ever",Physical therapy was very expensive,"After the therapy, he promised he would be more careful lifting heavy objects",He decided to start going to the gym so he can avoid this kind of injuries,"After few months, he felt better that ever",3.944,0.497,-0.033,0.949,-0.221,2.498,0.500,4.992,0.998,-0.372,35.475,0.657
test.sa-sb.sa::00716,Sam went on a date. He was nervous and ate too much at dinner. After a short while he started feeling sick. Sam had to cut the date short and go home.,0.0,content_diversity,He had to call her and apologise,Next day he called her and explained what had happened,He asked his date for forgivness,He was so embarrassed while explaining the reason for leaving,Next day he grabbed a phone and called to say sorry,2.611,0.567,-0.041,0.924,-0.273,2.498,0.500,4.917,0.983,-0.361,33.064,0.751
test.sa-sb.sa::00718,John woke up on the beach not remembering who he was. John looked at his belongings. John found a car key. John used the car key to find out the car.,1.0,content_diversity,He tried it until he found the right car.,He went to the hospital to get himself checked out.,He went to the local police station to help with identification.,He drove to the local grocery store and went in.,He drove around aimlessly.,4.389,0.515,-0.084,0.877,-0.400,2.131,0.426,4.834,0.967,-0.180,31.999,0.653
test.sa-sb.sa::00721,Randy tells his kids if they massage him all night he will reward them. He tells them he will give them 100 dollars each for doing it. The kids massage their father all night. When the morning comes the kids are excited to be done.,0.0,content_diversity,Every kid bought 100 dollars worth of toys,All kids were happy with their money spent on toys,Each of them decided to buy toys,"With 100 dollars, all kids bought new toys",Receiving their reward made them happy because now they can buy toys,2.000,0.598,-0.043,0.942,-0.320,2.836,0.567,4.453,0.891,-0.613,26.715,0.581
test.sa-sb.sa::00726,Chris is a star runner. Chris has a big race this sunday. He invited all his friends and family to the race. While at the race Chris runs as hard as he can.,1.0,content_diversity,Chris really wanted to show off in front of everyone but he ended up falling down instead.,"Unfortunately, Chris got disqualified from another event after jumping the gun several times.",Chris ended up winning the race and dedicating his win to his mother.,Chris had his best race ever even breaking a state record.,Chris was nervous about his friends and family being there but persevered and won.,4.214,0.995,-0.033,0.953,-0.302,2.691,0.538,4.975,0.995,-0.389,46.711,0.631
test.sa-sb.sa::00731,I had my special cup on my desk. I accidentally bumped it. It fell and rolled over the edge. It hit the husky and bounced off.,0.0,content_diversity,Cup landed softly on the rug,"When cup bounced off, it landed on the carpet","Fortunately, the cup landed softly and didn't shatter",Cup fell on the carpet but nothing happened,Carpet was soft so when cup fell down it didn't shatter,2.222,0.749,-0.075,0.891,-0.319,2.919,0.584,4.990,0.998,-0.670,29.349,0.611
test.sa-sb.sa::00738,James wanted to go swimming. He made plans with friends. Unfortunately it started to rain. Most of his friends cancelled.,1.0,content_diversity,James didn't care about the rain and went swimming anyway.,James got mad at his friends for canceling and stayed home and played games.,James was really angry about the rain and told his friends he was mad at them too.,One of James' friends didn't cancel and they went swimming together.,James decided to go swimming anyway and found that the pool was closed.,3.722,0.671,-0.075,0.892,-0.364,2.492,0.498,4.738,0.948,-0.414,47.863,0.638
test.sa-sb.sa::00739,Sam went out drinking. He tried to drive home. He couldn't find his keys. He had to call a taxi.,1.0,content_diversity,Sam didn't care about being responsible but the bar did and took his keys.,Sam was furious that his keys were missing but went home anyway.,Sam couldn't find anyone to give him a ride so he had to call for a ride.,Sam's friends at the bar took his keys making Sam angry at everyone.,Sam was so drunk he shouldn't have been driving anyway.,3.611,0.657,-0.047,0.916,-0.274,2.326,0.465,4.910,0.982,-0.387,45.480,0.576
test.sa-sb.sa::00744,Tim always loved reading and writing. He decided to try and write a book. It took him a long time. Not many people read it.,0.0,content_diversity,It was a cult classic,The few you read it were big fans,Tim develop a small loyal fan base,The book was considered an acquired taste but some liked it,"It had a polarizing reaction, people either loved or hated it",3.500,0.527,-0.022,0.967,-0.220,2.563,0.513,4.996,0.999,-0.502,30.083,0.700
test.sa-sb.sa::00745,Brett got new shoes today. His old ones had a hole in them. He really does not like his new shoes. Brett wanted his old shoes back.,1.0,content_diversity,he got his old shoes back,he exchange the new pair for a new pair of his old shoes,he threw the new shoes away,he decided to try the new shoe anyway,he keeps the new shoes,3.222,0.629,-0.122,0.854,-0.432,1.582,0.316,4.986,0.997,-0.610,23.399,0.616
test.sa-sb.sa::00751,Tom was invited to a party. He wasn't much of a beer drinker. He got whatever he saw on sale. Everyone at the party was a bit disappointed.,1.0,content_diversity,it was not his fault though,they wanted better booze,they thought he was not being selective,they wanted him to put in more thoughts,"they were disappointed because the music was bad, not because of tom",3.333,0.745,-0.043,0.939,-0.212,2.008,0.402,4.969,0.994,-0.243,21.814,0.574
test.sa-sb.sa::00760,Karl was getting ready for work. He didn't have enough time to make breakfast. Karl decided to just eat some cereal. He poured out the cereal before checking the milk.,1.0,content_diversity,Turns out that the milk was sour and he ruined a good bowl of cereal.,Karl looked into the fridge and realized he didn't have any milk.,Karl put the cereal back into the box because he was out of milk.,Karl remember he didn't have any milk so put the cereal back.,Karl put the cereal in a sandwich bag and just ate it like granola because he had no milk.,3.722,0.629,-0.131,0.832,-0.404,2.338,0.468,4.794,0.959,-0.670,51.638,0.637
test.sa-sb.sa::00762,"In college, I heard my first opera. It was called Marriage of Figaro. The singers sang in English so we could understand the words. It was a very funny story.",1.0,content_diversity,I love this opera,I like opera ever since,I did not like other opera though,I enjoy telling other people about this story,I decide to buy the book on this opera,4.111,0.698,-0.072,0.926,-0.222,2.242,0.448,4.875,0.975,-0.325,17.491,0.530
test.sa-sb.sa::00764,Jake went bowling one day. It was his friend's birthday. Jake decided to be nice and let his friend win. The friend was excited over beating him.,0.0,content_diversity,Over ice cream Jake's friend happily reminisced about his win.,They got ice cream cake Jake's friend blew out the candles wishing that every birthday would be so perfect.,It was the perfect end to a lovely evening.,They created some good memories that day.,Over ice cream Jake's friend began to speculate as to whether he should bowl professionally.,4.000,0.624,-0.053,0.902,-0.301,2.380,0.476,4.941,0.988,-0.264,43.568,0.614
test.sa-sb.sa::00765,Jervis wanted to get a dog. He went to a pound to find a puppy. Jervis picked out a small puppy. He brought the puppy home and gave him some water to drink.,0.0,content_diversity,The puppy adored Jervis quickly and couldn't wait to bark out his love.,The puppy couldn't find enough ways to shoe Jervis how crazy he was about him.,Jervis got up to walk away and the puppy barked to tell him to stay with him.,The puppy was so grateful to be out of the cage he didn't know how to act so he barked at Jervis.,Jervis and the puppy played for hours because they were nuts for each other.,3.071,0.728,-0.065,0.910,-0.251,2.427,0.485,4.994,0.999,-0.635,54.095,0.588
test.sa-sb.sa::00767,Kate and her friends drove all the way to Las Vegas. But they didn't like their hotel. So they decided to look online. They sat in the car looking on their phones for a better deal.,1.0,content_diversity,Kate found a hotel for a lot cheaper.,They came across a hotel with more stars.,Kate's friend found a much better deal.,They finally saw one with much better reviews.,Kate found a website with better amenities.,3.333,0.527,-0.078,0.889,-0.462,2.323,0.465,4.644,0.929,-0.425,25.046,0.557
test.sa-sb.sa::00768,"Abby was invited to a girl's trip to Seattle with her friends. Abby accepted the invitation, and were on their way to Seattle. After checking in the hotel, Abby fell straight asleep. When Abby awoke, her friends had returned from their night out.",1.0,content_diversity,abby joined them for dinner,abby missed the event,abby asked how their nights went,abby was upset her friends did not wake her up,abby was sad to be left out,3.778,0.478,-0.037,0.955,-0.457,1.893,0.379,4.964,0.993,-0.393,21.065,0.658
test.sa-sb.sa::00776,Loren decided to wash the dishes for her roommates. She used a glass of water to soak the sponge in. After she washed everything she forgot to wash the glass. She left it next to the sink and a roommate tried to drink from it.,1.0,content_diversity,She grabbed it before her roommate could drink from it.,The roommate drank from it.,The roommate dropped the glass as they picked it up.,Her roommate decided to wash the glass instead.,Her roommate threw the glass at another one as they were fighting.,4.278,0.533,-0.076,0.899,-0.468,2.278,0.456,4.965,0.993,-0.455,31.584,0.631
test.sa-sb.sa::00779,Charles wanted a raise. He was nervous about asking his boss. He finally built up enough courage to do it. His boss appreciated his initiative.,0.0,content_diversity,Charles was given a raise and a promotion.,Charles was now the new supervisor.,Charles moved up the ranks and now works more closely with his boss.,His boss nominated him for employee of the month.,Charles received compensation and moved up in the ranks.,3.000,0.745,-0.052,0.918,-0.440,2.248,0.450,4.923,0.985,-0.582,31.398,0.628
test.sa-sb.sa-b::00240,There once was a person born without a brain. They tried and tried and tried to think. They read books and stared at screens until their eyes bled. Then one day they threw out all of their learning material.,0.0,content_diversity,they quit,they did not care,IT WAS TO HARD SO THEY WERE DONE,he gave up,he was done trying,1.889,0.567,-0.013,0.981,-0.194,1.715,0.343,4.513,0.903,-0.549,15.146,0.721
test.sa-sb.sa-b::00242,Chloe is an actress who just turned 19. She is very interested in politics. She decided to use her platform to raise political awareness. She started to campaign for Hillary Clinton.,0.0,content_diversity,she got a lot of offers,she was happy,lots of work came in,everyone wanted to work with her,she was constantly sought after,3.333,0.707,-0.033,0.950,-0.288,2.374,0.475,4.940,0.988,-0.458,14.582,0.583
test.sa-sb.sa-b::00247,"Brett was having some issues. He called his best friend Michael. They met at a coffee shop to talk. After a few hours, Brett felt like he knew what to do.",0.0,content_diversity,Michael professional made him an expert,Michael was afew years older and usually knew what to do,Michael has given Brett good advice in the past,Michael walks worked where brett did and knew how to advise him on work siutation,Michael was known for being a helpful friend,3.167,0.745,-0.033,0.959,-0.166,2.062,0.412,4.970,0.994,-0.572,32.807,0.670
test.sa-sb.sa-b::00249,Steve and Josie are newlyweds. But Josie suspects that Steve is already cheating. She told her friends and they all agreed Steve was up to something. They all decided to follow him one day.,1.0,content_diversity,he was taking dance lesson,he was learning how to make flower bouquet,he was indeed cheating,he was dating her best friend,he was actually working extra,3.944,0.762,-0.120,0.908,-0.277,1.683,0.337,4.954,0.991,-0.140,17.351,0.620
test.sa-sb.sa-b::00251,Don was out on a field. He saw a rabbit get close. Don decided to chase it. The rabbit ran away slowly.,0.0,content_diversity,he went shopping afterwards,went to the store later,he had to go gracery shopping,dan bought groceries,dan went to get food,1.667,0.408,-0.043,0.928,-0.375,2.381,0.476,4.702,0.940,-0.458,13.974,0.608
test.sa-sb.sa-b::00256,Jane wanted to watch a big new action movie. She had been waiting a long time for it to come out. When tickets became available she was too busy. By the time she had a chance to buy some it was sold out.,1.0,content_diversity,Jane cried all the way home.,Jane found a ticket scalper to sell her tickets.,A friend of Jane's offered her one of her tickets.,Jane decided to go to another town to see it.,Jane decided to just wait and stream it at home when it becomes available.,4.111,0.567,-0.041,0.920,-0.250,2.420,0.484,4.770,0.954,-0.333,31.267,0.558
