sample_id,context,label_value,label_name,resp_0,resp_1,resp_2,resp_3,resp_4,metric_abs_hds_mean,metric_abs_hds_std,metric_AveragedCosineSimilarity,metric_AveragedDistinctNgrams,metric_BertScore,metric_SD,metric_SD_norm,metric_SSD,metric_SSD_norm,metric_SentBert,metric_TSD,metric_TSD_norm
test.sa-sb.sa-b::00262,It was a really hot day and Jamie wanted something sweet. Seeing a cute ice cream shop nearby she decided to go in. While waiting she noticed two children who looked very sad. She soon realized they had no money.,1.0,content_diversity,"Tough, thought Jamie and walked passed them holding his ice cream.",Jamie felt sorry for them so asked them what they wanted and got it for them.,Jamie told the shopkeepr to give them some free ice cream but he refused.,Jamie told the kids if they would wash his bike he would give them some money and they agreed.,Jamie gave them his ice cream to share and they were very grateful.,4.056,0.685,-0.085,0.882,-0.276,2.466,0.493,4.987,0.997,-0.472,49.223,0.623
test.sa-sb.sa-b::00268,Karl woke up late for work one day. He didn't know why his alarm didn't go off. Later that day his alarm went off. Karl realized he put PM instead of AM>.,1.0,content_diversity,He missed a job interview,He was late for work and got fired,He missed a bus,He had to hurry up,He had to skip breakfast,3.611,0.774,-0.092,0.881,-0.308,1.690,0.338,4.986,0.997,-0.343,13.987,0.518
test.sa-sb.sa-b::00272,Every month I start craving chocolate and salt. The cravings get so bad I can't resist them. I end up eating chips and candy bars. Eating those things makes my stomach start hurting.,0.0,content_diversity,"In the end I always throw up, it's awful.","I am always sick after, I hate it.","When I have finished eating I always throw up, it's horrible.","I always end up puking, it's awful.","After I have eaten I am always sick, it's awful.",1.611,0.515,-0.146,0.812,-0.625,2.890,0.578,4.719,0.944,-0.805,32.205,0.511
test.sa-sb.sa-b::00274,Gwen's old couch was falling apart. She saved up money to get a new one. She looked for the best price around. Finally she found one she liked for the right price.,1.0,content_diversity,When it arrived it was perfect for her living room and she was very happy.,When she got it home she realised it didn't fit with the rest of the room and she would have to redecorate.,She ordered it and was told it would take three months to arrive and she was very disappointed.,She was even happier when the salesman said today was a special 25% off day.,Jane bought it and could not stop thinking about how great it was going to look on the way home.,4.556,0.550,-0.078,0.902,-0.284,2.834,0.567,4.989,0.998,-0.298,64.651,0.660
test.sa-sb.sa-b::00276,Ron is having a cook out with the family. Ron is wearing his favorite shirt to impress everyone. While preparing his hot dog Ron spills some mustard on his shirt. Ron gets upset and rushes inside to clean his shirt.,1.0,content_diversity,His wife brings him a clean shirt and reassures him she can get the stain out.,Ron gives up on cleaning his shirt and throws it away.,"The neighbor, who overheard what happened, shows up to help Ron with her secret stain remover solution.",Ron throws away all the mustard bottles so it won't happen again.,Ron decides he is done for the day and goes to bed.,4.667,0.408,-0.031,0.953,-0.302,2.513,0.503,4.984,0.997,-0.301,51.463,0.668
test.sa-sb.sa-b::00279,Harry and his basketball team was losing the game. The coach called for a timeout. Harry boosted morale by talking to his team. The team caught up and the game was tied.,0.0,content_diversity,He scored winner,Harry scored a winning point,Harry scored a point that won them a game,He scores final point,He scored last point,1.500,0.378,-0.092,0.869,-0.488,1.684,0.337,4.107,0.821,-0.621,12.743,0.510
test.sa-sb.sa-b::00285,It was Isabella's first day at school. She thought she was going to like it. When the bus drove away she started crying. All she wanted was her mother.,0.0,content_diversity,The bus driver began a happy melody to improve the mood.,She laughed at the funny tune coming from the front of the bus.,The bus driver had a happy sing along of familiar tunes.,The bus driver chanted a fun chorus that chased the blues away.,The bus driver bebopped causing Isabella to joyfully play along.,1.833,0.577,-0.100,0.890,-0.463,2.170,0.434,4.892,0.978,-0.594,34.872,0.562
test.sa-sb.sa-b::00294,Sean was on a diet. He lost a lot of pounds. Eventually his pants fit too big. Even his belt was hard to fit.,1.0,content_diversity,Sean had to go to the clothing store to buy new clothes for his new body.,His wife was proud of him for sticking to his diet and losing so many pounds.,Sean felt sad he couldn't wear his favorite pair of pants anymore.,He decided to donate his old clothes to charity.,He visited a tailor to adjust his pants to his current body.,4.389,0.458,-0.057,0.935,-0.354,2.796,0.559,4.934,0.987,-0.331,45.991,0.639
test.sa-sb.sa-b::00295,It had been raining for two days straight. Kim's apartment basement became flooded. Her things in storage were destroyed. She didn't have any insurance.,0.0,content_diversity,Kim went to a store to buy items.,Kim looked online for a way to replace what she lost.,Kim went to a brick and mortar store to purchase things.,Kim went to a garage sale immediately.,Kim decided she would need up to date replacements so she left the house.,2.778,0.629,-0.133,0.868,-0.363,2.067,0.413,4.124,0.825,-0.465,30.217,0.540
test.sa-sb.sa-b::00296,Mike wanted to get a new car. He saved up all of his money from work. It took him two summers to have enough money. Finally he was able to go buy a new car.,1.0,content_diversity,He decided to wait until next year so he could get a better car.,He decided he wanted to put his money in a savings account instead.,He decided to donate his money to a charity instead.,He bought a really decent four door car that was red.,He went and bought a gaming laptop instead.,4.444,0.497,-0.075,0.905,-0.403,2.283,0.457,4.989,0.998,-0.261,36.546,0.599
test.sa-sb.sa-b::00299,Rita fell out of the tree. She broke her arm in two places. The doctor put her arm in a cast. It is purple and looks really neat.,0.0,content_diversity,Cast was pricey,Cast was costly,It was quite expensive,It costed a lot of money,It was pricey cast,1.722,0.583,-0.085,0.890,-0.557,1.856,0.371,4.259,0.852,-0.804,14.931,0.747
test.sa-sb.sa-b::00301,"My neighbor Steve went food shopping. He buys his vegetables from a farm stand in Belmont, MA. Steve showed off some locally grown artichokes. Steve said this was unusual, as artichokes are hot weather veggies.",0.0,content_diversity,They were delicious,He said he enjoyed the taste,Artichokes were tasty,The flavour was extremely delicious,Everyone liked their flavour,2.111,0.393,-0.016,0.971,-0.279,2.404,0.481,4.898,0.980,-0.660,12.136,0.578
test.sa-sb.sa-b::00302,"I am starting on my third marriage. I am very worried about how it will work out. Until now, I never felt love for the men I was married to. Now that I do love one, he is not very kind.",1.0,content_diversity,i stopped being nervous,it turned out great,i had a happy marriage,the wedding was great,i weighed the pros and cons,3.611,0.393,-0.021,0.965,-0.292,1.774,0.355,4.310,0.862,-0.374,14.037,0.610
test.sa-sb.sa-b::00312,"Jack bought some ice cream from the store. When he arrived back at his apartment, there were kids outside. Jack decided that the kids deserved a treat. He got out cups and served them ice cream.",0.0,content_diversity,When he got back everyone was gone,"When he returned, none was there",When he got back all kids were gone,"When he came back, everyone disappeared",No one was there when he came back,1.562,0.390,-0.123,0.836,-0.588,2.044,0.409,4.285,0.857,-0.764,20.493,0.554
test.sa-sb.sa-b::00325,The man lit the torch. He scorched the surface of the beef. He told his guests that it was a seared recipe. His guests were impressed by it's flavor.,0.0,content_diversity,the steak was so umami,the steak was decadent,it was so juicy,it was so succulent,it was very tasty,2.222,0.885,-0.154,0.793,-0.476,1.778,0.356,4.426,0.885,-0.538,13.329,0.635
test.sa-sb.sa-b::00329,Ken loved going to church. He spent time with family. He got to learn valuable lessons. They even went to eat after.,0.0,content_diversity,it was delicious,the meal was tasty,the food was to his liking,he enjoyed his meal,he likes what they eat that day,2.000,0.471,-0.032,0.950,-0.354,2.372,0.474,4.677,0.935,-0.805,13.079,0.545
test.sa-sb.sa-b::00330,Jake was never in his son's life. His son got the lead role in his Christmas play. Jake promised he would show up. On the day of the play Jake got drunk.,1.0,content_diversity,he showed up drunk,he was not able to come,he made it anyway,his son was still happy to see him,Jake missed the play,3.611,0.657,-0.019,0.969,-0.297,2.103,0.421,4.159,0.832,-0.136,16.711,0.643
test.sa-sb.sa-b::00354,Kate slept on a couch in a suite in Las Vegas. There weren't enough beds for everyone. Kate was always stiff after a night of sleeping on a couch. However today she only had a slightly stiff neck.,1.0,content_diversity,Later in the day her neck started to feel worse again.,Kate put that down to the CBD oil she took before bed.,This couch was more comfortable than most.,Kate was grateful that her day in Vegas was not ruined by a stiff neck.,The next night Kate got a bed and a friend slept on the sofa.,4.556,0.369,-0.025,0.949,-0.238,3.234,0.647,4.997,0.999,-0.197,40.752,0.637
test.sa-sb.sa-b::00357,Janice has a caffeine addiction but doesn't have a lot of money. She went to the store to see what she could get to satisfy her need. She ended up buying chocolate ice cream and soda to make a drink. After getting home she mixed the chocolate ice cream and soda.,0.0,content_diversity,Overall they liked it,She likes the drink,She thought the drink was pretty good,Overall the drink ended up being good,It turned out to be really good,2.222,0.533,-0.050,0.928,-0.421,2.660,0.532,4.946,0.989,-0.640,18.140,0.626
test.sa-sb.sa-b::00365,Ken loved his favorite comedy. He excitedly showed it to his girlfriend. She watched it all the way through without laughing. Ken nervously asked if she liked it.,1.0,content_diversity,Kate said it was terrible.,"Kate said she thought it was great, she wasn't a LOL type of girl.",It was then he realised she was asleep and probably had been the whole movie.,Kate said she had seen it before but didn't like to say.,"Kate was dead, that was why she was so quiet.",4.583,0.449,-0.079,0.912,-0.222,2.818,0.564,4.971,0.994,-0.307,43.323,0.647
test.sa-sb.sa-b::00366,Tucker is sitting home one night bored. He gets a text from his friend Sherry. She asks him to come out dancing with her. Tucker agrees and heads out to meet her.,0.0,content_diversity,The traffic is so bad that he doesn't make it to the club and ends up back at home.,He ends up returning home when he sees how much traffic there is.,The level of traffic is so high that he never gets to the club and turns back.,He turns back when he see how terrible the traffic is.,Traffic is awful on the roads so he decides to turn around and return to his house.,1.889,0.698,-0.091,0.874,-0.437,2.885,0.577,4.958,0.992,-0.511,56.039,0.667
test.sa-sb.sa-b::00370,Jake was looking forward to a movie for months. He was excited by all the previews. He got early screening tickets. The movie was not what Jake expected at all.,0.0,content_diversity,Very disappointed in the movie Jake was...,Jake was very sad the movie did not live up to its billing,Jake felt cheated as the previews were the best bits of the film.,Jake was very let down.,Jake felt misled as the previews had looked so good.,2.833,0.667,-0.084,0.890,-0.381,2.473,0.495,4.349,0.870,-0.566,28.149,0.521
test.sa-sb.sa-b::00376,"It was the day of Shannon's wedding. She was terrified, but excited. She waited in the dressing room until the wedding planner called her. She walked down the aisle with her father.",0.0,content_diversity,It couldn't get any better for her.,She still remembers it.,The whole thing was magical.,A moment to never be forgotten.,"Overtime, truly memorable for her.",2.444,0.497,-0.011,0.976,-0.183,2.890,0.578,4.314,0.863,-0.415,20.145,0.576
test.sa-sb.sa-b::00378,Jane need to get something from the store. But she was late for an appointment. She grabbed her things quickly and headed to checkout. She thought it would be quick.,0.0,content_diversity,She didn't the cashier being held up was even a possibility.,She never thought the store being robbed was possible.,She was taken back by the men in masks demanding money.,"In shock, she complied with the requests of the thieves.",Being a witness to a robbery was not on her to do list that day.,2.389,0.698,-0.037,0.954,-0.241,2.822,0.564,4.475,0.895,-0.331,40.109,0.627
test.sa-sb.sa-b::00387,Jane moved in and started working on an old house she bought. When thirsty she went to get a cup of water. But nothing came out of the faucet. She went to the basement to discover there were no pipes.,1.0,content_diversity,"She phoned the realtor who said she should have checked this when she viewed, Jane is furious.",Luckily Janes best friend is a plumber and she put it all right very quickly.,Jane had to go to the shop for bottled water and tried to figure out what to do.,Jane had forgotten about this so had to carry on and just be thirsty.,Jane phoned the police as she realised the copper pipes had been stolen.,4.667,0.527,-0.037,0.937,-0.182,2.888,0.578,4.935,0.987,-0.298,53.705,0.647
test.sa-sb.sa-b::00388,Ken wanted to be a rapper. He practiced often. He tried to join a local rap battle. He froze and was embarrassed.,0.0,content_diversity,"After that day, ken never rapped again.",Ken never rapped again after what had happened to him.,Nobody ever heard ken rap again after that day.,Ken never rapped again after that incident.,"After that happened , Ken gave up wanting to be a rapper.",2.111,0.698,-0.132,0.825,-0.519,2.420,0.484,3.694,0.739,-0.825,29.320,0.575
test.sa-sb.sa-b::00389,"Janice arrived on campus. She parked her car and started to walk towards the main hall. The double front doors were open when she was nearby. However, they started to close and smacked her in the face.",0.0,content_diversity,It stung for hours.,It made her eyes water.,The pain was intense.,She cried for a while.,She never felt such pain.,2.833,0.471,-0.017,0.965,-0.361,2.311,0.462,4.999,1.000,-0.406,10.955,0.391
test.sa-sb.sa-b::00395,"Abby recently had a physical done by her doctor. During the visit Abby told her doctor she wanted to tone her body. Abby's doctor recommended that she do strength training exercises. After leaving the doctor, Abby researched strength training exercises.",0.0,content_diversity,Abby found that the exercises were simple.,She learned how easy it is to do these exercises.,The exercises ended up being easy.,Abby found that they are not at all challenging.,They were not particularly demanding at all.,2.111,0.657,-0.041,0.924,-0.455,2.870,0.574,4.868,0.974,-0.638,25.842,0.587
test.sa-sb.sa-b::00406,Ken is a cook. While at work Ken begins cooking meals. While cooking a customer notices Ken spitting in their food. They complain to the manger.,0.0,content_diversity,Ken is sacked right away.,Ken is fired right at that moment.,Getting fired is the only thing that is going to happen to Ken.,The manger has no choice other than to let Ken go.,The manager fires Ken right away.,1.786,0.452,-0.068,0.918,-0.398,2.417,0.483,4.639,0.928,-0.604,26.895,0.572
test.sa-sb.sa-b::00407,Glenn has been living a lie his whole life. Glenn was a gay teenager. Glenn knew he needed to tell his parents his true self. One evening while having dinner Glenn tells them he is gay.,1.0,content_diversity,His parents are not shocked as they knew already and Glenn is relieved.,Glenns dad kicks Glenn out the house and he has to stay at his friends.,Glenns mom hates the idea but his dad is cool and says he will talk mum round.,His mum and dad reply they are splitting up as they both realise they are gay too.,Glenns mum faints and his dad kills himself. Glenn doubts this was a good idea.,4.611,0.567,-0.050,0.924,-0.294,3.086,0.514,4.994,0.999,-0.418,49.100,0.592
test.sa-sb.sa-b::00414,Jake was making a sandwich. He had all the ingredients ready. He put everything together. Right before taking a bit he noticed the moldy bread.,1.0,content_diversity,He ate the sandwich anyway.,He decided to give the sandwich to his dog instead.,He threw the sandwich in the trash.,"He went outside,found a homeless man and have him the sandwich.",He hurriedly put the sandwich down and went outside to vomit.,4.357,0.350,-0.110,0.902,-0.430,2.472,0.494,4.974,0.995,-0.485,33.290,0.653
test.sa-sb.sa-b::00416,I forgot to turn my hit monitor on. I sat there for a long time wishing there was something to do. I finally realized I had forgotten. I turned it on quickly.,1.0,content_diversity,My day's already off to a great start!,I'll just count the time wasted as meditation break.,"A side glance at the clock made me even more anxious, five minutes already passed.",I couldn't wait to check for my acceptance email.,I wanted to do my daily social media stalking of my ex.,4.444,0.643,-0.015,0.974,-0.162,2.278,0.456,4.980,0.996,-0.175,42.467,0.653
test.sa-sb.sa-b::00426,"I stole the assistant principal's walkie talkie. He looked for it for days. He knew someone took it, but didn't know who. He questioned a kid, and she told on me.",0.0,content_diversity,I can now no longer go back to that school ever again.,"They expelled me permanently, I cannot believe it.",I am now excluded for good.,I am now expelled forever.,They kicked me out of school for good.,1.833,0.408,-0.063,0.914,-0.445,2.211,0.442,4.917,0.983,-0.693,30.053,0.668
test.sa-sb.sa-b::00433,Jane was walking home at night. She went by a dark alley. A stranger leaped out and grabbed her purse. Jane tried to fight back but couldn't.,1.0,content_diversity,Jane was killed by the stranger.,Jane lost her purse to the stranger as he fled.,Jane started screaming for help and the stranger ran.,Jane fell to the ground unconcious.,Jane let go of the purse and ran away.,4.250,0.692,-0.080,0.913,-0.386,2.226,0.445,4.993,0.999,-0.524,25.414,0.565
test.sa-sb.sa-b::00437,"Gary had practiced mixed martial arts his whole life. He finally got the chance to fight for a championship. His opponent was tough, but beatable. Gary trained and studied his opponent.",1.0,content_diversity,He ended up beating his opponent.,It ended up losing anyway.,His skills showed in the ring.,He never prepared so well before.,He ended up defeating him.,3.556,0.497,-0.057,0.920,-0.424,1.944,0.389,4.970,0.994,-0.371,17.455,0.529
test.sa-sb.sa-b::00447,I hate too much noise around me. The kids get up and start running around. The one with autism stims very loudly. I put earplugs in so I don't have to hear it.,0.0,content_diversity,I wish it was all all over sometimes.,Some days I feel like killing myself.,Some times it gets so bad I feel like ending it all.,I could end my life because of it somedays.,On some days I actually think about suicide.,2.188,1.059,-0.054,0.920,-0.386,2.398,0.480,4.969,0.994,-0.632,30.526,0.623
test.sa-sb.sa-b::00448,Jane had broken her first pair of glasses. And now she had to tell her mother. She was sure to be upset. After telling her mom Jane braced herself for the yelling.,1.0,content_diversity,"To her surprise, her mom didn't get mad.",She got mad just as she thought.,her level of madness was lower then expected.,She really wished she didn't have to tell her.,"The moment she started yelling, she regretted telling her.",3.611,0.393,-0.037,0.951,-0.233,3.106,0.621,4.995,0.999,-0.394,32.636,0.628
test.sa-sb.sa-b::00577,Sally is in a relationship with her dream guy. She feels so lucky to be with such a handsome guy. One night while on a date he sits down and talks to her. He tells her that he just isn't feeling a connection with her.,0.0,content_diversity,Sally is heartbroken and leaves the restaurant.,"As she is running out of the restaurant, Sally is sobbing hysterically.",Sally is hysterical as her dream guy stands up to leave.,The waitress consoles Sally as the guy leaves her in the restaurant.,Sally is so upset she crashes her car after leaving the restaurant.,3.083,0.837,-0.088,0.906,-0.434,2.986,0.597,4.976,0.995,-0.558,35.401,0.590
test.sa-sb.sa-b::00579,"Pip built a treehouse with his dad. Tonight, they're going to have a super secret sleep over there. Pip made plans for the whole night and his dad bought snacks. Pip's mom promised she'd let them have a boys' night.",0.0,content_diversity,the tree house had its first night,the new tree house was used for the first time,"that night, the new tree house was utilized",that was the first time the tree house was used after built,that was the newly built treehouse's first time being put into use,1.833,0.816,-0.178,0.765,-0.489,2.583,0.517,4.920,0.984,-0.847,35.524,0.683
test.sa-sb.sa-b::00582,Viri went to the gym. She headed straight for the squat press. Viri has been working out hard the past few months. She's ready to add some more weight to the bar.,1.0,content_diversity,She added more weight and found she could easily lift it.,This was too heavy for her so she had to take them off.,It was too much and Viri put her back out.,She found it too easy so added even more.,the weights fell off the bar an crashed to the floor.,4.167,0.577,-0.029,0.937,-0.284,2.903,0.581,4.915,0.983,-0.382,39.417,0.667
test.sa-sb.sa-b::00597,My neighbor took an Uber on an errand. She took her two year old to the doctor. Her four year old saw her get into the Uber car. He started crying.,0.0,content_diversity,He cried continuously until they returned.,He wailed non stop until the came home.,He cried the entire time they were away.,His crying did not stop until they came home.,His crying did not cease until he saw them again.,2.111,0.875,-0.079,0.862,-0.531,2.277,0.455,4.995,0.999,-0.649,22.265,0.484
test.sa-sb.sa-b::00612,"Kate was at a gas station on the highway. She went in to get Advil. But they also had earbuds which she needed terribly. They were both low quality, and expensive.",1.0,content_diversity,She thought what the heck and bought them anyway.,Kate refused to pay so much for them and so did not buy them.,Kate had a huge argument with the guy behind the counter after trying to get him to lower the prices.,When the guy behind the counter was not looking Kate slipped them both in her hand bag.,Kate decied to wait until the next station and see what they had there.,4.611,0.393,-0.061,0.904,-0.228,2.727,0.545,4.983,0.997,-0.316,52.061,0.660
test.sa-sb.sa-b::00621,John was invited to a barbecue. He was asked to bring extras. He got chips and dip. He was welcomed warmly at the barbecue.,0.0,content_diversity,everyone loves chips and dips,no one can resist chips and dips,chips is a favorite at the party,"people like chip and dips, it is the way it is",chips are easy pick at party,2.278,0.786,-0.056,0.906,-0.276,2.131,0.426,4.466,0.893,-0.692,27.229,0.737
test.sa-sb.sa-b::00623,Larry wanted to go out with friends. They wanted to go to a bar. Larry had a bit of a drinking problem but went anyway. He got too drunk and made a fool of himself.,0.0,content_diversity,he was too drunk to drive home,he could not drink and drive,he was not able to drive his vehicle home,he was in no position to operate his car,he did not drive his car home,1.944,0.550,-0.101,0.875,-0.449,1.946,0.389,4.972,0.994,-0.675,23.213,0.611
test.sa-sb.sa-b::00640,Fred had always wanted to visit Spain. He saves his money for a big trip. Finally it is time for him to visit. He eats great food and meets interesting people.,1.0,content_diversity,it was a great trip,it was worth it,he decides to stay there longer,he moves there after,then he was off to italy,3.889,0.567,-0.043,0.926,-0.237,2.885,0.577,4.962,0.992,-0.261,15.697,0.628
test.sa-sb.sa-b::00643,My car was running rough the other day. I looked it over but couldn't figure out the problem. I ended up taking it to the local mechanic. He was able to identify the problem quickly.,1.0,content_diversity,He told me how much it was going to cost and then fixed it.,He said the car was beyond repair.,He then said he could not fix it as he was too busy.,He then said he was in a good mood and would fix it for free.,He said he nbeeded a part that would take four days to arrive.,4.167,0.527,-0.079,0.889,-0.352,2.708,0.542,4.999,1.000,-0.245,39.908,0.596
test.sa-sb.sa-b::00646,Lance is working hard on building a new room to his house. He works very hard day and night to get in done quick. One night while working all day he wanted to keep going and finish it. He began working while being tired and hammered his hand accidentally.,0.0,content_diversity,the hand broke,his hand was broken,he has broken his hand himself,the hand bone was fractured,his bone was damaged,1.833,0.408,-0.087,0.874,-0.532,2.140,0.428,4.966,0.993,-0.720,12.168,0.553
test.sa-sb.sa-b::00648,Dennis uses tinder to get a date. He finds a pretty girl and asks her out. On his date he takes her out to eat. He has a good time and asks if he can see her again.,1.0,content_diversity,she said yes,she said no,they became boyfriend girlfriend after,two years later they are married,she said she is moving away,4.278,0.342,-0.064,0.926,-0.142,2.422,0.484,4.875,0.975,-0.183,14.841,0.645
test.sa-sb.sa-b::00651,Sam's television was stolen. He was shopping for a replacement. He didn't have much money. Sam was looking at used ones when he found his old one.,0.0,content_diversity,he demand his old one back,the old tv was returned to the owner,he retrieve his old tv,he was able to recover his old tv,he reclaim what was his,2.444,0.550,-0.104,0.868,-0.384,2.302,0.460,4.512,0.902,-0.564,22.336,0.698
